{
  "schema_version": 1,
  "id": "01HQ7AB000000000000000ABCF",
  "slug": "info-provider",
  "label": "Info via provider",
  "visibility": "bundled",
  "entries": [
    {
      "id": "01HQ7AB000000000000000ENT4",
      "slug": "dynamic-readme",
      "label": "Dynamic readme",
      "kind": "info",
      "info": { "provider": "broker-providers-list" }
    }
  ]
}
